id_Symbol,id_Entrez,id_OMIM,id_humanID,id_HPRD,id_HGNC,id_Chromosome location,id_hPSD,id_Gene group,id_Main class,id_Accompanying phenotype,id_Inheritance pattern,id_Inheritance type,id_Limited confidence criterion,id_Disease type,id_Disease subtype,id_Haploinsufficiency,id_OMIM disease,id_Gene ontology-based annotation,id_Screened wing,id_Screened neuronal
PECR,55825,605843,ENSG00000115425,9320,18281,2q35,0,ID data freeze 650,6,P,Mendelian autosomal,recessive,1,non-syndromic ID,non-syndromic ID,0,NULL,"mitochondria, peroxisome",0,0
PEPD,5184,613230,ENSG00000124299,1358,8840,19q13.11,0,ID data freeze 388,5,"J, M, S",Mendelian autosomal,recessive,0,PROLIDASE DEFICIENCY,PROLIDASE DEFICIENCY,0,170100,NULL,1,1
PEX1,5189,602136,ENSG00000127980,3682,8850,7q21.2,0,ID data freeze 388,"2, 5","C, E, G, H, L2, M, T",Mendelian autosomal,recessive,0,PEROXISOME BIOGENESIS DISORDER (ZELLWEGER); PEROXISOME BIOGENESIS DISORDER,PEROXISOME BIOGENESIS DISORDER 1A (ZELLWEGER); PBD1A; PEROXISOME BIOGENESIS DISORDER 1B; PBD1B,0,214100; 601539,"peroxisome, protein transport, transporters",1,1
PEX10,5192,602859,ENSG00000157911,4175,8851,1p36.32,0,ID data freeze 388,"2, 5","C, E, G, H, L2, M, T",Mendelian autosomal,recessive,0,PEROXISOME BIOGENESIS DISORDER (ZELLWEGER); PEROXISOME BIOGENESIS DISORDER,PEROXISOME BIOGENESIS DISORDER 6A (ZELLWEGER); PBD6A; PEROXISOME BIOGENESIS DISORDER 6B; PBD6B,0,614870; 614871,"peroxisome, protein transport, transporters",1,1
PEX11B,8799,603867,ENSG00000131779,4844,8853,1q21.1,1,ID data freeze 650,5,"H, M, O, T",Mendelian autosomal,recessive,1,PEROXISOME BIOGENESIS DISORDER,PEROXISOME BIOGENESIS DISORDER 14B; PEX14B,0,614920,"mitochondria, peroxisome",0,0
PEX12,5193,601758,ENSG00000108733,3455,8854,17q12,0,ID data freeze 388,2,"C, E, G, H, L2, M, T",Mendelian autosomal,recessive,0,PEROXISOME BIOGENESIS DISORDER (ZELLWEGER); PEROXISOME BIOGENESIS DISORDER,PEROXISOME BIOGENESIS DISORDER 3A (ZELLWEGER); PBD3A; PEROXISOME BIOGENESIS DISORDER 3B; PBD3B,0,614859; 266510,"peroxisome, protein transport, transporters",1,1
PEX13,5194,601789,ENSG00000162928,3475,8855,2p16.1,0,ID data freeze 388,2,"C, E, G, H, L2, M, T",Mendelian autosomal,recessive,0,PEROXISOME BIOGENESIS DISORDER (ZELLWEGER); PEROXISOME BIOGENESIS DISORDER,PEROXISOME BIOGENESIS DISORDER 11A (ZELLWEGER); PBD11A; PEROXISOME BIOGENESIS DISORDER 11B; PBD11B,0,614883; 614885,"nervous system development, peroxisome, protein transport, transporters",1,1
PEX26,55670,608666,ENSG00000215193,10559,22965,22q11.21,0,ID data freeze 388,8b,"C, E, (G), H, L2, M",Mendelian autosomal,recessive,0; 1,PEROXISOME BIOGENESIS DISORDER (ZELLWEGER); PEROXISOME BIOGENESIS DISORDER,PEROXISOME BIOGENESIS DISORDER 7A (ZELLWEGER); PBD7A; PEROXISOME BIOGENESIS DISORDER 7B; PBD7B,0,614872; 614873,"peroxisome, protein transport, transporters",0,0
PEX5,5830,600414,ENSG00000139197,2684,9719,12p13.31,0,ID data freeze 388,2,"C, E, G, H, L2, M, T",Mendelian autosomal,recessive,0,PEROXISOME BIOGENESIS DISORDER (ZELLWEGER); PEROXISOME BIOGENESIS DISORDER,PEROXISOME BIOGENESIS DISORDER 2A (ZELLWEGER); PBD2A; PEROXISOME BIOGENESIS DISORDER 2B; PBD2B,0,214110; 202370,"mitochondria, nervous system development, peroxisome, protein transport, small GTPase signaling, transporters",1,1
PEX6,5190,601498,ENSG00000124587,3293,8859,6p21.1,0,ID data freeze 388,2,"C, E, G, H, M, T",Mendelian autosomal,recessive,0; 1,PEROXISOME BIOGENESIS DISORDER (ZELLWEGER); PEROXISOME BIOGENESIS DISORDER,PEROXISOME BIOGENESIS DISORDER 4A (ZELLWEGER); PBD4A; PEROXISOME BIOGENESIS DISORDER 4B; PBD4B,0,614862; 614863,"metabolism, peroxisome, protein transport, transporters",1,1
PEX7,5191,601757,ENSG00000112357,3454,8860,6q23.3,0,ID data freeze 388,"1, 5","A, C, E, G, H, M, T, Ub",Mendelian autosomal,recessive,0,RHIZOMELIC CHONDRODYSPLASIA PUNCTATA; PEROXISOME BIOGENESIS DISORDER,"RHIZOMELIC CHONDRODYSPLASIA PUNCTATA, TYPE 1; RCDP1; PEROXISOME BIOGENESIS DISORDER 9B; PBD9B",0,215100; 614879,"nervous system development, peroxisome, protein transport, transporters",1,1
PGAP2,27315,615187,ENSG00000148985,17016,17893,11p15.5,0,ID data freeze 650,2,"B, E, (L2), M",Mendelian autosomal,recessive,0,HYPERPHOSPHATASIA WITH MENTAL RETARDATION SYNDROME,HYPERPHOSPHATASIA WITH MENTAL RETARDATION SYNDROME 3; HPMRS3,0,614207,transporters,0,0
PGK1,5230,311800,ENSG00000102144,2412,8896,Xq13.3,1,ID data freeze 388,8a,"H, M, Q, R",Mendelian X-linked,recessive,0,PHOSPHOGLYCERATE KINASE 1 DEFICIENCY,PHOSPHOGLYCERATE KINASE 1 DEFICIENCY,0,300653,NULL,0,0
PHF6,84295,300414,ENSG00000156531,2330,18145,Xq26.3,0,ID data freeze 388,5,"A, K, O",Mendelian X-linked,recessive,0,BORJESON-FORSSMAN-LEHMANN SYNDROME,BORJESON-FORSSMAN-LEHMANN SYNDROME; BFLS,0,301900,"metabolism, RNA metabolism, transcription",0,0
PHF8,23133,300560,ENSG00000172943,6599,20672,Xp11.22,0,ID data freeze 388,4,Uc,Mendelian X-linked,recessive,1,SIDERIUS X-LINKED MENTAL RETARDATION SYNDROME,SIDERIUS X-LINKED MENTAL RETARDATION SYNDROME; MRXSSD,0,300263,"cell cycle, chromatin, metabolism, microtubule, nervous system development, RNA metabolism, transcription",0,0
PHGDH,26227,606879,ENSG00000092621,6047,8923,1p12,1,ID data freeze 388,5,"B, E, M",Mendelian autosomal,recessive,0,PHOSPHOGLYCERATE DEHYDROGENASE DEFICIENCY,PHOSPHOGLYCERATE DEHYDROGENASE DEFICIENCY,0,601815,"cell cycle, metabolism, nervous system development",1,1
PIGN,23556,606097,ENSG00000197563,12085,8967,18q21.33,0,ID data freeze 650,1,"C, E, H, V, W, X",Mendelian autosomal,recessive,1,MULTIPLE CONGENITAL ANOMALIES-HYPOTONIA-SEIZURES SYNDROME,MULTIPLE CONGENITAL ANOMALIES-HYPOTONIA-SEIZURES SYNDROME 1; MCAHS1,0,614080,NULL,0,0
PIGO,84720,614730,ENSG00000165282,15134,23215,9p13.3,0,ID data freeze 650,1,"(E), M, U, (V), (X)",Mendelian autosomal,recessive,1,HYPERPHOSPHATASIA WITH MENTAL RETARDATION SYNDROME,HYPERPHOSPHATASIA WITH MENTAL RETARDATION SYNDROME 2; HPMRS2,0,614749,NULL,0,0
PIGT,51604,610272,ENSG00000124155,15136,14938,20q12-q13.12,0,ID data freeze 650,2,"E, F, L2, Q, T, U, W",Mendelian autosomal,recessive; dominant,1; 0,MULTIPLE CONGENITAL ANOMALIES-HYPOTONIA-SEIZURES SYNDROME; PAROXYSMAL NOCTURNAL HEMOGLOBINURIA ,MULTIPLE CONGENITAL ANOMALIES-HYPOTONIA-SEIZURES SYNDROME 3; MCAHS3; PAROXYSMAL NOCTURNAL HEMOGLOBINURIA 2; PNH2,0,615398; 615399,nervous system development,0,0
PIGV,55650,610274,ENSG00000060642,7912,26031,1p36.11,0,ID data freeze 388,1,"(E), M, Ua",Mendelian autosomal,recessive,0,HYPERPHOSPHATASIA WITH MENTAL RETARDATION SYNDROME,HYPERPHOSPHATASIA WITH MENTAL RETARDATION SYNDROME 1; HPMRS1,0,239300,glycosylation,1,1
PIK3CA,5290,171834,ENSG00000121879,1382,8975,3q26.3,0,ID data freeze 650,7,"F, G, L1, S",Somatic; Mendelian autosomal,N/A; dominant,0,MEGALENCEPHALY-CAPILLARY MALFORMATION-POLYMICROGYRIA SYNDROME; COWDEN SYNDROME,MEGALENCEPHALY-CAPILLARY MALFORMATION-POLYMICROGYRIA SYNDROME; MCAP; COWDEN SYNDROME 5; CWS5,0,602501; 615108,"cardiac muscle contraction, metabolism, response to growth factor, transporters, vesicle transport",0,0
PIK3R1,5295,171833,ENSG00000145675,1381,8979,5q13.1,0,ID data freeze 650,8a,"A, (B), K, T, U, (V)",Mendelian autosomal,dominant,0,SHORT SYNDROME,SHORT SYNDROME,0,269880,"metabolism, protein transport, response to growth factor, RNA metabolism, transcription, transporters, vesicle transport",0,0
PIK3R2,5296,603157,ENSG00000105647,4404,8980,19q13.2-q13.4,0,ID data freeze 650,4,"F, L1, Ua",Mendelian autosomal,dominant,0,MEGALENCEPHALY-POLYMICROGYRIA-POLYDACTYLY-HYDROCEPHALUS SYNDROME,MEGALENCEPHALY-POLYMICROGYRIA-POLYDACTYLY-HYDROCEPHALUS SYNDROME; MPPH,0,603387,"response to growth factor, small GTPase signaling, transporters, vesicle transport",0,0
PLCB1,23236,607120,ENSG00000182621,6177,15917,20p12,1,ID data freeze 650,8b,"E, H",Mendelian autosomal,recessive,1,"EPILEPTIC ENCEPHALOPATHY, EARLY INFANTILE","EPILEPTIC ENCEPHALOPATHY, EARLY INFANTILE, 12; EIEE12",0,613722,"cell cycle, chromatin, glutamate receptor signaling, MAPK signaling, metabolism, nervous system development, RNA metabolism, synapse, transcription, transporters, vesicle transport",0,0
PLP1,5354,300401,ENSG00000123560,2321,9086,Xq22,1,ID data freeze 388,2,"(C), E, H, L2",Mendelian X-linked,recessive,0,"PELIZAEUS-MERZBACHER DISEASE; SPASTIC PARAPLEGIA, X-LINKED","PELIZAEUS-MERZBACHER DISEASE; PMD; SPASTIC PARAPLEGIA 2, X-LINKED; SPG2",0,312080; 312920,"metabolism, nervous system development, synapse",1,1
PMM2,5373,601785,ENSG00000140650,3472,9115,16p13,0,ID data freeze 388,5,"A, C, H, L2, M, R, T",Mendelian autosomal,recessive,0,CONGENITAL DISORDER OF GLYCOSYLATION,"CONGENITAL DISORDER OF GLYCOSYLATION, TYPE IA; CDG1A",0,212065,glycosylation,1,1
PNKP,11284,605610,ENSG00000039650,9284,9154,19q13.3-q13.4,0,ID data freeze 650,2,"B, E, P",Mendelian autosomal,recessive,0,"EPILEPTIC ENCEPHALOPATHY, EARLY INFANTILE","EPILEPTIC ENCEPHALOPATHY, EARLY INFANTILE, 10; EIEE10",0,613402,DNA repair,0,0
PNP,4860,164050,ENSG00000198805,1247,7892,14q13.1,0,ID data freeze 388,8a,"H, J, M",Mendelian autosomal,recessive,0,PURINE NUCLEOSIDE PHOSPHORYLASE DEFICIENCY,PURINE NUCLEOSIDE PHOSPHORYLASE DEFICIENCY; PURINE NUCLEOSIDE PHOSPHORYLASE DEFICIENCY,0,613179,"protein transport, transporters, vesicle transport",1,1
PNPT1,87178,610316,ENSG00000138035,18493,23166,2p15,0,ID data freeze 650,8b,"(G), H, L2, M",Mendelian autosomal,recessive,1; 0,"COMBINED OXIDATIVE PHOSPHORYLATION DEFICIENCY; DEAFNESS, AUTOSOMAL RECESSIVE","COMBINED OXIDATIVE PHOSPHORYLATION DEFICIENCY 13; COXPD13; DEAFNESS, AUTOSOMAL RECESSIVE 70; DFNB70",0,614932; 614934,"cell cycle, metabolism, mitochondria, RNA metabolism, transporters",0,0
POC1A,25886,614783,ENSG00000164087,8523,24488,3p21.2,0,ID data freeze 650,8a,"A, S, U",Mendelian autosomal,recessive,0,"SHORT STATURE, ONYCHODYSPLASIA, FACIAL DYSMORPHISM, AND HYPOTRICHOSIS","SHORT STATURE, ONYCHODYSPLASIA, FACIAL DYSMORPHISM, AND HYPOTRICHOSIS; SOFT",0,614813,"centrosome, Cilia, microtubule",0,0
POLR3A,11128,614258,ENSG00000148606,17879,30074,10q22-q23,0,ID data freeze 650,8b,"G, H, (K), L2, (U)",Mendelian autosomal,recessive,0,"LEUKODYSTROPHY, HYPOMYELINATING, WITH OR WITHOUT OLIGODONTIA AND/OR HYPOGONADOTROPIC HYPOGONADISM","LEUKODYSTROPHY, HYPOMYELINATING, 7, WITH OR WITHOUT OLIGODONTIA AND/OR HYPOGONADOTROPIC HYPOGONADISM; HLD7",0,607694,"chromatin, RNA metabolism, transcription",0,0
POLR3B,55703,614366,ENSG00000013503,11447,30348,12q23.3,0,ID data freeze 650,5,"G, H, (K), L2",Mendelian autosomal,recessive,0,"LEUKODYSTROPHY, HYPOMYELINATING","LEUKODYSTROPHY, HYPOMYELINATING, 8, WITH OR WITHOUT OLIGODONTIA AND/OR HYPOGONADOTROPIC HYPOGONADISM; HLD8",0,614381,"RNA metabolism, transcription",0,0
POMGNT1,55624,606822,ENSG00000085998,9493,19139,1p34.1,0,ID data freeze 388,"1, 4","C, E, G, L1, P, Q, T",Mendelian autosomal,recessive,0; 1,MUSCULAR DYSTROPHY-DYSTROGLYCANOPATHY (CONGENITAL WITH BRAIN AND EYE ANOMALIES); MUSCULAR DYSTROPHY-DYSTROGLYCANOPATHY (CONGENITAL WITH MENTAL RETARDATION); MUSCULAR DYSTROPHY-DYSTROGLYCANOPATHY (LIMB-GIRDLE),"MUSCULAR DYSTROPHY-DYSTROGLYCANOPATHY (CONGENITAL WITH BRAIN AND EYE ANOMALIES), TYPE A, 3/WALKER-WARBURG/MUSCLE-EYE-BRAIN; MUSCULAR DYSTROPHY-DYSTROGLYCANOPATHY (CONGENITAL WITH MENTAL RETARDATION), TYPE B, 3; MDDGB3; MUSCULAR DYSTROPHY-DYSTROGLYCANOPATHY (LIMB-GIRDLE), TYPE C, 3; MDDGC3",0,253280; 613151; 613157,glycosylation,0,0
POMGNT2,84892,614828,ENSG00000144647,7863,25902,3p22.1,0,ID data freeze 650,1,"C, H, L1, Q, T",Mendelian autosomal,recessive,0,MUSCULAR DYSTROPHY-DYSTROGLYCANOPATHY (CONGENITAL WITH BRAIN AND EYE ANOMALIES),"MUSCULAR DYSTROPHY-DYSTROGLYCANOPATHY (CONGENITAL WITH BRAIN AND EYE ANOMALIES), TYPE A, 8; MDDGA8",0,614830,glycosylation,0,0
POMT1,10585,607423,ENSG00000130714,6305,9202,9q34.1,0,ID data freeze 388,"1, 4","B, C, L1, Q, T",Mendelian autosomal,recessive,0,MUSCULAR DYSTROPHY-DYSTROGLYCANOPATHY (CONGENITAL WITH BRAIN AND EYE ANOMALIES); MUSCULAR DYSTROPHY-DYSTROGLYCANOPATHY (CONGENITAL WITH MENTAL RETARDATION); MUSCULAR DYSTROPHY-DYSTROGLYCANOPATHY (LIMB-GIRDLE),"MUSCULAR DYSTROPHY-DYSTROGLYCANOPATHY (CONGENITAL WITH BRAIN AND EYE ANOMALIES), TYPE A, 1; MDDGA1; MUSCULAR DYSTROPHY-DYSTROGLYCANOPATHY (CONGENITAL WITH MENTAL RETARDATION), TYPE B, 1; MDDGB1; MUSCULAR DYSTROPHY-DYSTROGLYCANOPATHY (LIMB-GIRDLE), TYPE C, 1; MDDGC1",0,236670; 613155; 609308,glycosylation,0,0
POMT2,29954,607439,ENSG00000009830,9592,19743,14q24,0,ID data freeze 388,1,"B, C, L1, Q, T",Mendelian autosomal,recessive,0,MUSCULAR DYSTROPHY-DYSTROGLYCANOPATHY (CONGENITAL WITH BRAIN AND EYE ANOMALIES); MUSCULAR DYSTROPHY-DYSTROGLYCANOPATHY (CONGENITAL WITH MENTAL RETARDATION); MUSCULAR DYSTROPHY-DYSTROGLYCANOPATHY (LIMB-GIRDLE),"MUSCULAR DYSTROPHY-DYSTROGLYCANOPATHY (CONGENITAL WITH BRAIN AND EYE ANOMALIES), TYPE A, 2; MDDGA2; MUSCULAR DYSTROPHY-DYSTROGLYCANOPATHY (CONGENITAL WITH MENTAL RETARDATION), TYPE B, 2; MDDGB2; MUSCULAR DYSTROPHY-DYSTROGLYCANOPATHY (LIMB-GIRDLE), TYPE C, 2; MDDGC2",0,613150; 613156; 613158,glycosylation,1,1
PORCN,64840,300651,ENSG00000102312,6680,17652,Xp11.23,0,ID data freeze 388,7,"S, T, Ua, Uc, X",Mendelian X-linked,dominant,0,FOCAL DERMAL HYPOPLASIA,FOCAL DERMAL HYPOPLASIA; FDH,0,305600,"ion transport, transporters, Wnt signaling",1,1
PPOX,5498,600923,ENSG00000143224,2953,9280,1q22,0,ID data freeze 388,8a,"E, H, M, S",Mendelian autosomal,not sure,0,PORPHYRIA VARIEGATA,PORPHYRIA VARIEGATA,0,176200,mitochondria,1,1
PQBP1,10084,300463,ENSG00000102103,2354,9330,Xp11.23,0,ID data freeze 388,1,"A, B, W, X",Mendelian X-linked,recessive,0,RENPENNING SYNDROME,RENPENNING SYNDROME 1; RENS1,0,309500,"metabolism, RNA metabolism, transcription",1,1
PRKCG,5582,176980,ENSG00000126583,1502,9402,19q13.4,1,ID data freeze 650,5,"G, H",Mendelian autosomal,recessive; dominant,1,SPINOCEREBELLAR ATAXIA ,SPINOCEREBELLAR ATAXIA 14; SCA14; SPINOCEREBELLAR ATAXIA 14; SCA14,0,605361,"DNA repair, metabolism, nervous system development, response to growth factor, synapse, ubiquitination",0,0
PRKRA,8575,603424,ENSG00000180228,4573,9438,2q31.2,1,ID data freeze 650,"5, 6","G, H",Mendelian autosomal,recessive,1,non-syndromic ID; DYSTONIA,non-syndromic ID; DYSTONIA 16; DYT16,0,605361,"metabolism, RNA metabolism",0,0
PRMT9,90826,NULL,ENSG00000164169,14280,25099,4q31.23,0,ID data freeze 650,3,NULL,Mendelian autosomal,recessive,1,non-syndromic ID,non-syndromic ID,0,NULL,NULL,0,0
PRODH,5625,606810,ENSG00000100033,8433,9453,22q11.21,1,ID data freeze 650,5,"E, M, P",Mendelian autosomal,recessive,0,HYPERPROLINEMIA,"HYPERPROLINEMIA, TYPE I; HPI",0,239500,mitochondria,0,0
PRPS1,5631,311850,ENSG00000147224,2413,9462,Xq22.3,1,ID data freeze 388,5,"C, H, J, M",Mendelian X-linked,recessive,0,ARTS SYNDROME; PHOSPHORIBOSYLPYROPHOSPHATE SYNTHETASE SUPERACTIVITY; CHARCOT-MARIE-TOOTH DISEASE; DEAFNESS,"ARTS SYNDROME; ARTS; PHOSPHORIBOSYLPYROPHOSPHATE SYNTHETASE SUPERACTIVITY; CHARCOT-MARIE-TOOTH DISEASE, X-LINKED RECESSIVE, 5; CMTX5; DEAFNESS",0,301835; 300661; 311070; 304500,nervous system development,1,1
PRRT2,112476,614386,ENSG00000167371,13995,30500,16p11.2,0,ID data freeze 650,3,NULL,Mendelian autosomal,recessive; dominant,1; 0,"non-syndromic ID; CONVULSIONS, FAMILIAL INFANTILE, WITH PAROXYSMAL CHOREOATHETOSIS; EPISODIC KINESIGENIC DYSKINESIA; SEIZURES, BENIGN FAMILIAL INFANTILE","non-syndromic ID; CONVULSIONS, FAMILIAL INFANTILE, WITH PAROXYSMAL CHOREOATHETOSIS; ICCA; EPISODIC KINESIGENIC DYSKINESIA 1; EKD1; SEIZURES, BENIGN FAMILIAL INFANTILE, 2; BFIS2",0,602066; 128200; 605751,synapse,0,0
PRSS12,8492,606709,ENSG00000164099,5989,9477,4q28.1,0,ID data freeze 388,6,NULL,Mendelian autosomal,recessive,1,"MENTAL RETARDATION, AUTOSOMAL RECESSIVE","MENTAL RETARDATION, AUTOSOMAL RECESSIVE 1; MRT1",0,249500,"synapse, transporters, vesicle transport",0,0
PTCH1,5727,601309,ENSG00000185920,3200,9585,9q22.3,0,ID data freeze 388,4,"L1, Uc",Mendelian autosomal,dominant,0,HOLOPROSENCEPHALY; BASAL CELL NEVUS SYNDROME,HOLOPROSENCEPHALY 7; HPE7; BASAL CELL NEVUS SYNDROME; BCNS,1,610828; 109400,"cell cycle, hedgehog signaling, metabolism, nervous system development, protein transport, RNA metabolism, synapse, transcription, transporters",0,0
PTCHD1,139411,300828,ENSG00000165186,6548,26392,Xp22.11,0,ID data freeze 650,6,P,Mendelian X-linked,not sure,1,"ASD, ID","ASD, ID",0,NULL,hedgehog signaling,0,0
PTDSS1,9791,612792,ENSG00000156471,17926,9587,8q22,0,ID data freeze 650,4,"A, B, (L1), S, U, Ua, Ub, W, (X)",Mendelian autosomal,dominant,0,Lenz-Majewski syndrome,Lenz-Majewski syndrome,0,NULL,NULL,0,0
PTEN,5728,601728,ENSG00000171862,3431,9588,10q23.3,0,ID data freeze 388,8a,"F, (I), P",Mendelian autosomal,dominant,0; 1,MACROCEPHALY/AUTISM SYNDROME; BANNAYAN-RILEY-RUVALCABA SYNDROME; COWDEN SYNDROME; VACTERL ASSOCIATION WITH HYDROCEPHALUS,MACROCEPHALY/AUTISM SYNDROME; BANNAYAN-RILEY-RUVALCABA SYNDROME; BRRS; COWDEN SYNDROME 1; CWS1; VACTERL ASSOCIATION WITH HYDROCEPHALUS,1,605309; 153480; 158350; 276950,"cell cycle, metabolism, mitochondria, nervous system development, response to growth factor, RNA metabolism, synapse, transcription, transporters, ubiquitination, vesicle transport, Wnt signaling",1,1
PTPN11,5781,176876,ENSG00000179295,1470,9644,12q24,1,ID data freeze 388,7,"A, Q, R, S, T, V",Mendelian autosomal,dominant,0,NOONAN SYNDROME; LEOPARD SYNDROME; METACHONDROMATOSIS,NOONAN SYNDROME 1; NS1; LEOPARD SYNDROME 1; METACHONDROMATOSIS; METCDS,0,163950; 151100; 156250,"cell cycle, MAPK signaling, metabolism, mitochondria, nervous system development, protein transport, response to growth factor, transporters",1,1
PUS1,80324,608109,ENSG00000177192,10481,15508,12q24.33,0,ID data freeze 388,8a,"M, Q, R",Mendelian autosomal,recessive,0,"MYOPATHY, LACTIC ACIDOSIS, AND SIDEROBLASTIC ANEMIA","MYOPATHY, LACTIC ACIDOSIS, AND SIDEROBLASTIC ANEMIA 1; MLASA1",0,600462,"metabolism, mitochondria, RNA metabolism, transcription",1,1
PVRL1,5818,600644,ENSG00000110400,7200,9706,11q23.3,0,ID data freeze 388,7,"S, Ua, Uc",Mendelian autosomal,recessive,1,CLEFT LIP/PALATE-ECTODERMAL DYSPLASIA SYNDROME,CLEFT LIP/PALATE-ECTODERMAL DYSPLASIA SYNDROME; CLPED1,0,225060,"ion transport, nervous system development, synapse, transporters",0,0
PYCR1,5831,179035,ENSG00000183010,1528,9721,17q25.3,0,ID data freeze 388,5,"A, (B), (L2), S, T, U",Mendelian autosomal,recessive,0; 1,"CUTIS LAXA, AUTOSOMAL RECESSIVE","CUTIS LAXA, AUTOSOMAL RECESSIVE, TYPE IIB; ARCL2B; CUTIS LAXA, AUTOSOMAL RECESSIVE, TYPE IIIB; ARCL3B; CUTIS LAXA, AUTOSOMAL RECESSIVE, TYPE IIB; ARCL2B; CUTIS LAXA, AUTOSOMAL RECESSIVE, TYPE IIIB; ARCL3B",0,612940; 614438,mitochondria,1,1
RAB18,22931,602207,ENSG00000099246,3731,14244,10p12.1,1,ID data freeze 650,1,"B, H, T, U",Mendelian autosomal,recessive,0,WARBURG MICRO SYNDROME,WARBURG MICRO SYNDROME 3; WARBM3,0,614222,"nervous system development, small GTPase signaling, transporters",0,0
RAB27A,5873,603868,ENSG00000069974,4845,9766,15q15-q21.1,0,ID data freeze 388,8a,"C, H, J, R, S",Mendelian autosomal,recessive,0,GRISCELLI SYNDROME,"GRISCELLI SYNDROME, TYPE 2; GS2",0,607624,"protein transport, small GTPase signaling, transporters, vesicle transport",0,0
RAB39B,116442,300774,ENSG00000155961,6703,16499,Xq28,0,ID data freeze 388,6,"(E), (F), (P)",Mendelian X-linked,not sure,0,"MENTAL RETARDATION, X-LINKED","MENTAL RETARDATION, X-LINKED 72; MRX72",0,300271,"small GTPase signaling, synapse, transporters, vesicle transport",1,1
RAB3GAP1,22930,602536,ENSG00000115839,16002,17063,2q21.3,1,ID data freeze 388,1,"B, H, L1, T",Mendelian autosomal,recessive,0,WARBURG MICRO SYNDROME,WARBURG MICRO SYNDROME 1; WARBM1,0,600118,"MAPK signaling, metabolism, nervous system development, small GTPase signaling",1,1
RAB3GAP2,25782,609275,ENSG00000118873,11471,17168,1q41,1,ID data freeze 388,"1, 4","B, H, L1, T, W, X",Mendelian autosomal,recessive,1,MARTSOLF SYNDROME; WARBURG MICRO SYNDROME,MARTSOLF SYNDROME; WARBURG MICRO SYNDROME 2; WARBM2,0,212720; 614225,"metabolism, protein transport, transporters",1,1
RAB40AL,282808,300405,ENSG00000102128,NULL,25410,Xq22.2,0,ID data freeze 650,5,"A, H, R, W",Mendelian X-linked,recessive,1,"MENTAL RETARDATION, X-LINKED, SYNDROMIC","MENTAL RETARDATION, X-LINKED, SYNDROMIC, MARTIN-PROBST TYPE; MRXSMP",0,300519,"mitochondria, small GTPase signaling, transporters, ubiquitination",0,0
RABL6,55684,610615,ENSG00000196642,12984,24703,9q34.3,0,ID data freeze 650,6,NULL,Mendelian autosomal,recessive,1,non-syndromic ID,non-syndromic ID,0,NULL,small GTPase signaling,0,0
RAD21,5885,606462,ENSG00000164754,5924,9811,8q24,0,ID data freeze 650,4,"A, B, U, (V)",Mendelian autosomal,dominant,0,CORNELIA DE LANGE SYNDROME,CORNELIA DE LANGE SYNDROME 4; CDLS4,0,614701,"cell cycle, chromosome segregation, DNA repair, metabolism, RNA metabolism, transcription",0,0
RAF1,5894,164760,ENSG00000132155,1265,9829,3p25,0,ID data freeze 388,7,"A, Q, R, T, V",Mendelian autosomal,dominant,0,NOONAN SYNDROME; LEOPARD SYNDROME,NOONAN SYNDROME 5; NS5; LEOPARD SYNDROME 2,0,611553; 611554,"MAPK signaling, metabolism, mitochondria, nervous system development, response to growth factor, small GTPase signaling, synapse, transporters",1,1
RAI1,10743,607642,ENSG00000108557,7406,9834,17p11.2,0,ID data freeze 388,5,"H, J, P",Mendelian autosomal,dominant,0,SMITH-MAGENIS SYNDROME,SMITH-MAGENIS SYNDROME; SMS,1,182290,"metabolism, RNA metabolism, transcription",1,1
RALGDS,5900,601619,ENSG00000160271,3371,9842,9q34.3,0,ID data freeze 650,6,NULL,Mendelian autosomal,recessive,1,non-syndromic ID,non-syndromic ID,0,NULL,"MAPK signaling, metabolism, response to growth factor, small GTPase signaling",0,0
RARB,5915,180220,ENSG00000077092,7183,9865,3p24.2,0,ID data freeze 650,7,"C, T, X",Mendelian autosomal,recessive; dominant,1,"MICROPHTHALMIA, SYNDROMIC","MICROPHTHALMIA, SYNDROMIC 12; MCOPS12; MICROPHTHALMIA, SYNDROMIC 12; MCOPS12",0,615524,"metabolism, nervous system development, RNA metabolism, transcription",0,0
RBBP8,5932,604124,ENSG00000101773,4990,9891,18q11.2,0,ID data freeze 650,"1, 5","A, B, L2, S, Ua",Mendelian autosomal,recessive,1,JAWAD SYNDROME; JWDS; SECKEL SYNDROME,JAWAD SYNDROME; JWDS; SECKEL SYNDROME 2; SCKL2,0,251255; 606744,"cell cycle, DNA repair, metabolism, RNA metabolism, transcription",0,0
RBM28,55131,612074,ENSG00000106344,7668,21863,7q32.1,0,ID data freeze 388,2,"G, H, K, S",Mendelian autosomal,recessive,1,"ALOPECIA, NEUROLOGIC DEFECTS, AND ENDOCRINOPATHY SYNDROME","ALOPECIA, NEUROLOGIC DEFECTS, AND ENDOCRINOPATHY SYNDROME",0,612079,RNA metabolism,1,1
RELN,5649,600514,ENSG00000189056,2742,9957,7q22,0,ID data freeze 388,1,"E, H, L1",Mendelian autosomal,recessive,0,LISSENCEPHALY,LISSENCEPHALY 2; LIS2,0,257320,"glutamate receptor signaling, metabolism, nervous system development, RNA metabolism, small GTPase signaling, synapse, TOR signaling, transcription, transporters",0,0
RFT1,91869,611908,ENSG00000163933,15239,30220,3p21.1,0,ID data freeze 388,2,"B, E, H, M",Mendelian autosomal,recessive,1,CONGENITAL DISORDER OF GLYCOSYLATION,"CONGENITAL DISORDER OF GLYCOSYLATION, TYPE IN; CDG1N",0,612015,"glycosylation, transporters",1,1
RGS7,6000,602517,ENSG00000182901,3948,10003,1q43|1q23.1,1,ID data freeze 650,6,P,Mendelian autosomal,recessive,1,non-syndromic ID,non-syndromic ID,0,NULL,metabolism,0,0
RIT1,6016,609591,ENSG00000143622,10195,10023,1q22,0,ID data freeze 650,8a,"A, S, V",Mendelian autosomal,dominant,0,NOONAN SYNDROME,NOONAN SYNDROME 8; NS8,0,615355,"MAPK signaling, response to growth factor, small GTPase signaling",0,0
RMND1,55005,614917,ENSG00000155906,9858,21176,6q25.1,0,ID data freeze 650,8b,"C, G, H, M",Mendelian autosomal,recessive,0,COMBINED OXIDATIVE PHOSPHORYLATION DEFICIENCY,COMBINED OXIDATIVE PHOSPHORYLATION DEFICIENCY 11; COXPD11,0,614922,mitochondria,0,0
RMRP,6023,157660,ENSG00000199916,NULL,10031,9p21-p12,0,ID data freeze 388,8a,"A, B, U",Mendelian autosomal,recessive,0,ANAUXETIC DYSPLASIA; CARTILAGE-HAIR HYPOPLASIA; METAPHYSEAL DYSPLASIA WITHOUT HYPOTRICHOSIS,ANAUXETIC DYSPLASIA; CARTILAGE-HAIR HYPOPLASIA; CHH; METAPHYSEAL DYSPLASIA WITHOUT HYPOTRICHOSIS,0,607095; 250250; 250460,NULL,0,0
RNASEH2A,10535,606034,ENSG00000104889,6914,18518,19p13.2,0,ID data freeze 388,2,"B, C, E, G, H, L2, S",Mendelian autosomal,recessive,0,AICARDI-GOUTIERES SYNDROME,AICARDI-GOUTIERES SYNDROME 4; AGS4,0,610333,"DNA repair, RNA metabolism",1,1
RNASEH2B,79621,610326,ENSG00000136104,NULL,25671,13q14.3,0,ID data freeze 388,2,"B, E, G, H, L2, S",Mendelian autosomal,recessive,0,AICARDI-GOUTIERES SYNDROME,AICARDI-GOUTIERES SYNDROME 2; AGS2,0,610181,"cell cycle, metabolism, RNA metabolism",1,1
RNASEH2C,84153,610330,ENSG00000172922,16531,24116,11q13.1,0,ID data freeze 388,2,"B, C, E, G, H, L2, S",Mendelian autosomal,recessive,0,AICARDI-GOUTIERES SYNDROME,AICARDI-GOUTIERES SYNDROME 3; AGS3,0,610329,RNA metabolism,1,1
ROGDI,79641,614574,ENSG00000067836,13388,29478,16p13.3,1,ID data freeze 650,2,"E, H, L2",Mendelian autosomal,recessive,0,KOHLSCHUTTER-TONZ SYNDROME,KOHLSCHUTTER-TONZ SYNDROME; KTZS,0,226750,NULL,0,0
RPGRIP1L,23322,610937,ENSG00000103494,17204,29168,16q12.2,0,ID data freeze 388,4,"H, L1, O, T, Ua, W",Mendelian autosomal,recessive,0; 1,JOUBERT SYNDROME; COACH SYNDROME; MECKEL SYNDROME,"JOUBERT SYNDROME 7; JBTS7; COACH SYNDROME; MECKEL SYNDROME, TYPE 5; MKS5",0,611560; 216360; 611561,"centrosome, Cilia, hedgehog signaling, microtubule, nervous system development",0,0
RPL10,6134,312173,ENSG00000147403,2421,10298,Xq28,0,ID data freeze 388,6,P,Mendelian X-linked,not sure,0,"AUTISM, SUSCEPTIBILITY TO","AUTISM, SUSCEPTIBILITY TO, X-LINKED 5; AUTSX5; AUTISM, SUSCEPTIBILITY TO, X-LINKED 5; AUTSX5",0,300847,"protein transport, RNA metabolism, transporters",1,1
RPS6KA3,6197,300075,ENSG00000177189,2092,10432,Xp22.2-p22.1,0,ID data freeze 388,"2, 6","A, B, (C), (H), Ub",Mendelian X-linked,not sure,0,"COFFIN-LOWRY SYNDROME; MENTAL RETARDATION, X-LINKED","COFFIN-LOWRY SYNDROME; CLS; MENTAL RETARDATION, X-LINKED 19; MRX19",0,303600; 300844,"cell cycle, MAPK signaling, metabolism, nervous system development, response to growth factor, RNA metabolism, synapse, transcription",1,1
